Ut vitae quam feugiat mauris scelerisque dignissim in in enim. Ut lobortis leo urna, sit amet dapibus nisl tincidunt et. Proin sagittis tristique orci non commodo. Quisque vel finibus quam, nec congue lorem. Lorem ipsum dolor sit amet, consectetur adipiscing elit. Suspendisse nec sapien non metus ornare mollis non vitae ligula. Curabitur diam enim, consectetur id sodales id, pulvinar eget neque. Proin pharetra bibendum euismod. Pellentesque at cursus metus. Cras posuere blandit arcu, eget placerat odio condimentum non. In molestie aliquam neque quis bibendum. Duis vitae tempus quam, ac lobortis turpis.

Nullam volutpat mattis dignissim. Morbi non diam vitae nunc pharetra fermentum. Aenean ac mi augue. Orci varius natoque penatibus et magnis dis parturient montes, nascetur ridiculus mus. In vulputate nulla metus, ut vehicula nibh varius in. Morbi porta nunc eu lectus facilisis dapibus. Maecenas non eros augue. Integer aliquet, mi ornare pellentesque faucibus, nibh tellus pretium lorem, quis interdum mauris diam quis turpis. Sed pulvinar convallis mattis. Maecenas rhoncus nisi quis mi interdum, non elementum diam tristique. Morbi sed diam a odio hendrerit scelerisque cursus id diam. Aenean a est vel dolor rhoncus sagittis a vel diam. Nulla consequat dolor consequat, aliquet neque sed, elementum diam.

Etiam facilisis turpis at elit tincidunt, sit amet dapibus sapien egestas. Integer ut aliquam eros. Vestibulum tempor, nisi vitae volutpat cursus, justo lorem mattis lectus, eget ullamcorper lacus dolor gravida odio. Morbi pharetra ligula lectus, vel egestas mauris laoreet in. Aenean sed iaculis arcu. Aliquam dignissim libero vitae quam maximus, vitae vestibulum lectus accumsan. Maecenas elementum in diam vitae rhoncus. Maecenas facilisis purus quis massa tristique, sit amet convallis enim facilisis. Aenean sit amet magna non arcu vulputate feugiat. Nullam sit amet sapien quis risus venenatis luctus. Etiam ex urna, laoreet ut tortor sed, placerat lobortis ipsum. Aliquam a interdum justo, mattis ornare massa. Donec sagittis felis sodales, convallis enim eu, posuere odio.

Donec quis purus ex. Cras sollicitudin blandit massa, at ultrices turpis vestibulum ac. Curabitur ultricies blandit sem, id vehicula ex luctus at. Nunc ac tortor nunc. Suspendisse eget enim quis leo efficitur pretium ac in eros. In hac habitasse platea dictumst. Ut libero ex, lobortis sed justo at, semper vestibulum tortor.

Nam eu consequat enim. Donec quis velit suscipit, sodales lacus eu, varius nunc. Nullam id augue nec metus tempor fringilla. Pellentesque vitae quam ut ligula laoreet convallis vel vitae nulla. Sed vitae auctor eros. Maecenas sit amet enim augue. Aliquam nec rutrum urna, a vulputate ante. Maecenas viverra a sapien at blandit. Aliquam cursus venenatis aliquet.

Nam eros neque, bibendum at dapibus non, semper quis enim. Vestibulum mattis vitae ligula eget pellentesque. Quisque a est in tortor vulputate pellentesque. Sed a iaculis est, at sollicitudin turpis. Duis ornare at tellus egestas fringilla. Sed pharetra iaculis tristique. Nam id nisi varius, tincidunt metus ac, cursus orci. Aenean eget ex fringilla, egestas sem a, pharetra eros. Pellentesque faucibus, sapien non ornare semper, nisi orci egestas felis, vel tincidunt odio lacus in nibh. Mauris ut turpis varius, ornare velit nec, venenatis tellus. Maecenas aliquet sed metus ut tempor.

Aenean convallis diam est, quis dictum leo commodo eu. Curabitur fermentum ipsum auctor massa scelerisque, id tristique felis malesuada. Nunc non sem justo. Donec tincidunt libero id vulputate gravida. In ut tristique diam. Cras id odio non leo euismod dapibus semper a mi. Donec dui elit, consectetur eu arcu eget, pellentesque tincidunt est. Mauris vel bibendum odio. Duis sed cursus urna, at consectetur ante. Mauris placerat nulla non consequat accumsan. Nullam dictum elementum euismod. Donec semper pharetra hendrerit. Ut hendrerit ac massa ut elementum. Duis quis lobortis diam, ac pellentesque urna.

Sed venenatis, tellus eget hendrerit viverra, tellus neque tincidunt lorem, condimentum laoreet ex diam quis felis. Maecenas tincidunt ligula molestie consectetur posuere. Mauris id nibh fringilla, tempus purus in, iaculis lectus. Phasellus euismod aliquet sapien eu lobortis. Sed ac luctus neque. Aenean suscipit nulla nec sagittis posuere. Quisque in tortor ipsum. Nulla tellus diam, finibus eu interdum ut, pharetra non dolor. Aliquam imperdiet ante et iaculis mattis. Curabitur blandit nisi quis felis dictum, ac feugiat enim feugiat. Suspendisse id diam sit amet mauris egestas vehicula id lobortis purus. Nam ac facilisis nibh, vestibulum imperdiet orci. Integer pulvinar consectetur ullamcorper. Fusce tincidunt sit amet risus vulputate bibendum. Donec vestibulum odio eros, vel dignissim felis lacinia a. Pellentesque risus tellus, sagittis nec vulputate varius, tincidunt quis diam.

Etiam ullamcorper leo a nunc pharetra, sit amet volutpat leo cursus. Donec facilisis ac nisl ut fermentum. In id quam id mauris accumsan tincidunt id eget tellus. Aenean pulvinar ut nulla ac semper. Nunc sed eleifend urna. Nullam sagittis et nisl vitae laoreet. Donec eget sodales odio, et venenatis orci. Aenean vitae varius nisl. Nam orci neque, auctor et ex quis, mattis malesuada nibh. Sed ut pharetra dui, ac tempor dolor. Vestibulum ut dapibus neque. In augue magna, lacinia eu nunc vel, maximus tempor urna.

Ut commodo lacus vitae mauris malesuada, sit amet fermentum sem volutpat. Vivamus volutpat est metus, sed elementum lectus tincidunt quis. Mauris congue feugiat quam, quis faucibus enim semper quis. Curabitur cursus lectus nunc. Donec aliquet nisl nisi, quis vestibulum neque finibus quis. Praesent porta sollicitudin urna eget blandit. Mauris rutrum efficitur ultricies. Suspendisse hendrerit felis id bibendum feugiat.

Vestibulum egestas ex at ipsum mattis, eget vestibulum sem semper. Aenean vel dignissim est. Aenean et ligula et lorem malesuada ultrices. Aenean et vestibulum erat, quis efficitur libero. Vestibulum non malesuada urna. Quisque sollicitudin leo vitae ultricies cursus. Proin mauris enim, eleifend rutrum maximus sed, vulputate a tortor.

Interdum et malesuada fames ac ante ipsum primis in faucibus. Pellentesque scelerisque turpis volutpat libero dignissim, vitae viverra nulla vehicula. Nam eget finibus nulla, varius interdum nibh. Vivamus eget cursus neque. Aliquam auctor, est nec tincidunt condimentum, sem erat consequat justo, a sollicitudin mi nibh at odio. Aenean a lorem quam. Mauris sed nunc consequat, feugiat sapien at, cursus turpis. Fusce diam dui, consectetur sit amet lacinia nec, suscipit sed massa. Pellentesque efficitur, dolor eu vulputate bibendum, justo odio malesuada mi, quis tincidunt ligula erat non lacus. Nam eget cursus arcu. Pellentesque placerat nisi dui, a volutpat ante venenatis a.

Donec ut metus vel orci rutrum convallis. Nullam imperdiet diam sed risus ornare posuere. Integer quis posuere leo. Mauris at dolor sed nulla suscipit suscipit. Donec mollis lacus quis pellentesque viverra. Vestibulum ante ipsum primis in faucibus orci luctus et ultrices posuere cubilia curae; Nam porttitor laoreet maximus. Maecenas lacus odio, facilisis et varius sed, posuere in neque. Aenean tempor porta massa, in venenatis felis. Ut finibus ante at tortor tempus, vel malesuada tortor interdum. Mauris tincidunt varius ex nec hendrerit. Sed maximus arcu ex, in finibus ligula ultricies at. Mauris at urna nunc. Aenean eget fringilla magna.

Morbi congue sodales elit vel tristique. Nulla et venenatis augue. Donec quis risus sollicitudin est luctus maximus. Sed elit arcu, pretium in euismod quis, pharetra in eros. Interdum et malesuada fames ac ante ipsum primis in faucibus. Donec porttitor nulla et imperdiet vulputate. Aenean eu pellentesque sem.

Donec tincidunt, nisl nec dictum posuere, ex neque imperdiet risus, vitae imperdiet nibh ligula vel nunc. Pellentesque molestie mollis tortor eu aliquet. Curabitur in consectetur leo. Vivamus suscipit sodales nulla sed porta. Suspendisse vitae auctor massa, eget varius metus. Donec pharetra malesuada ligula quis ultricies. Fusce pharetra, nisl ac viverra faucibus, ex libero tristique urna, non vulputate massa nibh id velit. Pellentesque molestie non nunc at finibus. Pellentesque finibus eros odio, ut vulputate ex suscipit id. Nunc aliquet bibendum tellus, viverra efficitur elit ornare sit amet. Pellentesque imperdiet viverra blandit. Nunc et leo tincidunt, rhoncus ipsum nec, mollis felis. Morbi dapibus felis quis mi facilisis, aliquet egestas nibh vehicula. Donec auctor, neque sed cursus luctus, sapien sem sagittis dolor, sit amet aliquet massa orci non dolor. Suspendisse et tempor eros, in vestibulum elit. Maecenas sit amet ultrices metus, sit amet pharetra quam.

Curabitur nunc turpis, convallis sed porta sed, dignissim vel orci. Curabitur dictum maximus mi in egestas. Cras tempor odio eget commodo pellentesque. Nunc lacinia dapibus aliquet. Proin eget lacus sit amet orci eleifend semper et sed arcu. Praesent bibendum et leo non ornare. Aenean ut iaculis enim, sed porttitor leo. Mauris efficitur accumsan orci, eget egestas ligula bibendum sagittis. Fusce at odio volutpat, commodo massa vel, lacinia erat. Integer ut gravida sem. Sed commodo gravida sem, id mattis elit posuere et.

Nam vel fermentum urna. Vestibulum ante ipsum primis in faucibus orci luctus et ultrices posuere cubilia curae; Sed at mauris rhoncus, luctus augue ut, eleifend nisl. Nulla facilisi. Phasellus pellentesque augue at magna sodales cursus. Donec sed pellentesque nunc. Ut in dignissim nulla. Vivamus id mauris hendrerit, malesuada mauris sit amet, tristique sem. Nullam fermentum placerat purus eget commodo. Proin efficitur dapibus purus scelerisque facilisis. Duis molestie tincidunt pellentesque. Nulla euismod leo non augue laoreet molestie. Suspendisse interdum nulla tempor diam aliquet porta.

In efficitur sed ipsum in vehicula. In nulla velit, elementum quis tempus eu, pharetra quis nisl. Quisque non fermentum sem. Proin nec tellus ex. Vestibulum faucibus lectus dui, quis pretium enim commodo eu. Praesent bibendum, purus id pellentesque consequat, nisi tortor hendrerit tellus, in luctus nisi nisl id felis. Sed volutpat, orci in eleifend viverra, augue ipsum interdum nisl, et efficitur augue diam a libero. Curabitur posuere auctor libero ut faucibus.

Phasellus ornare magna nulla. Ut ac vulputate libero, eu tempus felis. Praesent pharetra finibus mi vel sagittis. Donec est est, fringilla in lectus sed, pulvinar fermentum quam. Ut ac felis vitae risus semper vestibulum vitae sed orci. Donec id ultricies lorem, eu varius justo. Fusce lacus ex, scelerisque quis consectetur ut, fringilla nec turpis. Quisque id porttitor lorem. Morbi suscipit elit ut laoreet commodo. Nam egestas scelerisque felis, ut scelerisque enim ullamcorper at. Cras lectus massa, bibendum quis mattis sit amet, venenatis quis elit. Quisque pharetra arcu eget rhoncus volutpat. Donec viverra ex tellus, sollicitudin accumsan augue pretium in. Proin sodales massa vel lacus ultrices, mollis rhoncus nunc scelerisque.

Ut rhoncus orci scelerisque, aliquet nisi dignissim, volutpat metus. Proin nulla nibh, consequat et nunc at, ornare auctor neque. Cras at mattis dui. Quisque viverra est est, sed ullamcorper erat porta nec. Donec aliquam tortor lacus, a lacinia turpis auctor ac. Phasellus lobortis nisi elit. Fusce venenatis est massa, id suscipit arcu egestas at. Sed quis convallis eros, et sodales massa. Maecenas metus diam, pretium ac leo sit amet, imperdiet lobortis felis. Sed vel commodo mi. Nullam in varius felis, sed malesuada dui. Proin sit amet blandit diam, vitae finibus sem. Sed eu semper lectus. Pellentesque nec nunc dignissim, suscipit velit sit amet, cursus mi. Etiam porttitor viverra metus a feugiat. Pellentesque pharetra blandit magna, eget egestas neque blandit nec.

Vivamus pellentesque tortor ultricies, mattis sapien euismod, ullamcorper turpis. Praesent id posuere turpis. Cras tincidunt vestibulum purus. Vivamus et neque semper, sagittis diam at, facilisis massa. Ut ultricies metus eu nunc accumsan placerat. Quisque volutpat ac erat at malesuada. Mauris volutpat enim in velit blandit sollicitudin. Nullam aliquam ante eget mauris porta ornare. Vestibulum placerat, mi eu accumsan malesuada, velit nisi commodo elit, sed auctor dui nulla imperdiet erat. Nullam ultrices id tellus vulputate sodales. Proin leo urna, luctus et turpis elementum, fringilla iaculis neque. Etiam id egestas enim. Nam nulla nunc, accumsan vitae consequat nec, aliquet sed ligula. Vestibulum libero libero, aliquet et interdum nec, fermentum in erat. Donec consectetur interdum iaculis. Suspendisse eleifend risus sapien, vestibulum luctus urna dapibus et.

Fusce vel leo tempor, pulvinar arcu vel, pretium enim. Nullam sodales diam nec efficitur hendrerit. Maecenas molestie enim lorem, ac placerat ante suscipit vel. Nunc tempor accumsan risus, eu pulvinar odio. Maecenas a risus eget elit elementum vestibulum. Aenean ligula magna, dapibus ac auctor posuere, venenatis a nisi. Integer sed imperdiet dui. Mauris dignissim, mauris sit amet porttitor vulputate, nulla ex laoreet arcu, et pretium risus libero ut diam. Pellentesque efficitur augue eget urna molestie dignissim. Etiam posuere ligula ac arcu imperdiet, at ornare ipsum ullamcorper. Aliquam sed egestas enim. Vestibulum in urna fringilla, feugiat est vel, varius urna. Nunc efficitur consectetur nibh, elementum placerat ante posuere nec. Suspendisse ac tincidunt orci. In sit amet feugiat turpis, et porttitor sem.

Phasellus tempus ultrices ultricies. Donec et aliquet lectus. Suspendisse tempor ultricies purus vitae blandit. Integer a nibh mauris. Cras sed dictum erat. Etiam lorem leo, luctus vel mauris in, egestas congue arcu. Nulla ac lectus malesuada, congue massa vitae, bibendum est. Quisque volutpat purus sed erat dictum, et sagittis tortor euismod. Proin ipsum turpis, malesuada id urna at, lacinia elementum diam. Aliquam semper odio tempus ante tristique, a efficitur velit vehicula. Quisque lacus elit, tincidunt et euismod at, ullamcorper quis ipsum.

Morbi in ullamcorper elit, at porttitor eros. Sed imperdiet vulputate imperdiet. Donec congue lacus vulputate mi luctus cursus quis sed dui. Donec et fermentum lorem, sed volutpat nisl. Nunc posuere lobortis odio, aliquet pharetra justo porta eget. Curabitur et luctus massa. Cras quis sollicitudin arcu, ac hendrerit nunc. Integer venenatis odio augue, ac vehicula tellus ornare et. Pellentesque nec lectus ut nisi egestas consectetur non imperdiet urna. Vivamus vulputate in sapien a suscipit. Interdum et malesuada fames ac ante ipsum primis in faucibus. Curabitur iaculis in neque at tempus. Nulla velit sem, porttitor nec est et, semper maximus velit.

In leo libero, porttitor eu neque ut, tristique ornare ante. Maecenas mattis sagittis blandit. Morbi in elementum erat, eget eleifend dolor. Cras a tempus turpis. Sed scelerisque, neque in rutrum vulputate, leo eros feugiat nisl, ac sagittis orci ex molestie orci. Cras varius lobortis est, eu congue tellus. Nam vel tellus dapibus, rutrum est hendrerit, consectetur massa. Nam quis augue tincidunt, auctor arcu et, dapibus tortor. Vestibulum at erat tincidunt lectus vehicula ultricies. Suspendisse aliquam augue sed velit lobortis egestas. Ut sagittis tempus purus vel ornare.

Maecenas vulputate eget tortor sed faucibus. Aliquam at quam magna. Ut velit leo, varius vitae consequat facilisis, mattis vitae dui. Nam laoreet commodo augue vel cursus. Nullam euismod ac tellus et tempor. Donec eu elit lectus. Mauris sollicitudin lorem auctor leo mattis, in egestas leo ornare. Etiam in condimentum magna, quis ornare felis. Fusce ut purus est. Sed fringilla nec diam et ultrices. Pellentesque eu risus eu ex fringilla scelerisque.

Nam ullamcorper ipsum vel molestie varius. Vivamus nec lorem sagittis, tristique diam quis, auctor metus. Sed vitae felis vitae ante tempus lobortis vel ut felis. Phasellus et ex mauris. Praesent sapien sem, pulvinar in cursus ac, dapibus nec leo. Aliquam odio nunc, rutrum ut finibus id, euismod ac leo. Suspendisse potenti. Curabitur mattis, risus vitae faucibus aliquet, mi elit cursus risus, sed venenatis nibh urna in risus. Phasellus ornare molestie odio, a tempus felis cursus ut. Sed a metus sed eros tempus pretium. Nulla pharetra pellentesque mi, dapibus fringilla arcu varius congue. Donec risus tortor, scelerisque id interdum vel, fermentum blandit nunc. Praesent id leo turpis.

Maecenas justo lectus, laoreet sed tellus a, mollis pulvinar diam. Donec eget libero velit. Phasellus facilisis rhoncus commodo. Morbi et leo in lacus laoreet vehicula. Duis ante lacus, tincidunt vitae fermentum in, feugiat quis urna. Sed porttitor porta suscipit. Nulla suscipit velit eget nunc placerat vehicula. Nullam rutrum, tortor sit amet ornare semper, libero enim rhoncus quam, ut pharetra urna neque eu quam.

Maecenas ac metus magna. Phasellus vehicula sagittis neque ut fringilla. Nullam mattis dui nulla. Pellentesque congue maximus bibendum. In ullamcorper nisl ut mauris commodo aliquam. Cras ornare rutrum dolor, sed ultricies odio pretium eu. Nam mauris urna, lacinia sit amet mattis id, viverra id elit. Vivamus vel fringilla ligula, a mattis risus. Aliquam non tellus blandit, venenatis ipsum vitae, auctor nisl. Duis a diam et mi porttitor sodales ac vel ex.

Suspendisse at magna tincidunt, scelerisque nunc a, euismod nisl. Nulla sed porttitor turpis. Donec mattis dui nec arcu laoreet facilisis. Etiam suscipit nec nulla at faucibus. Ut et felis cursus, ultrices elit quis, efficitur dolor. Fusce vulputate ligula eget interdum semper. Donec commodo auctor erat, eget facilisis libero vehicula in. Integer eu consectetur turpis. Integer ut elit placerat dui gravida tristique quis et sapien. Maecenas vehicula cursus sem ac sodales. Duis lacinia erat mauris, ut sollicitudin purus vulputate eleifend.

Morbi molestie pretium est, sit amet ultricies quam aliquet ac. Vivamus finibus dolor in risus volutpat, quis elementum leo maximus. Nunc porta mauris lobortis, congue turpis a, tincidunt mi. Quisque est tellus, interdum id ornare ut, sagittis id lacus. Etiam nulla sapien, tincidunt ut pulvinar vitae, vestibulum in mi. Proin bibendum vestibulum nisl ut ornare. Proin at urna urna. Nam in venenatis purus. Praesent dolor lorem, scelerisque ac imperdiet ut, dictum eget erat. Sed pretium purus id sapien dictum molestie.

Vivamus commodo at quam vitae condimentum. Praesent finibus tempus ligula id elementum. Nulla facilisi. Pellentesque pellentesque condimentum mauris ut tincidunt. Aliquam erat volutpat. Vivamus aliquam lacinia convallis. Donec iaculis sit amet lectus non sollicitudin. Donec id ante vitae mi facilisis vehicula. Proin tellus risus, sollicitudin vitae est tincidunt, eleifend egestas quam. Vivamus vel imperdiet purus.

Fusce tincidunt metus at turpis dapibus efficitur. Fusce venenatis at eros sit amet imperdiet. Duis id lobortis metus. Sed gravida ante eget eros bibendum, sit amet bibendum velit facilisis. Nam elit dui, varius nec blandit a, mattis id odio. Proin ac mi ut purus ullamcorper vehicula sit amet sed tortor. Aliquam at massa ac mauris rhoncus vehicula. Suspendisse scelerisque aliquet mi. Phasellus ut cursus dolor. Aliquam ac urna sit amet felis rhoncus efficitur non et mauris. Pellentesque porta nulla id mi finibus, nec facilisis metus lacinia. Nulla tristique elit purus, vitae efficitur arcu laoreet in. In nec condimentum ligula, sed scelerisque tortor. Vestibulum lacinia, massa eu efficitur fermentum, augue justo eleifend urna, eget pretium turpis quam vitae odio.

Praesent faucibus sagittis nulla in scelerisque. Proin sapien leo, porta a eros in, iaculis sodales tortor. Duis accumsan ipsum quis nibh euismod, nec lobortis neque dapibus. Donec ullamcorper blandit lectus sed consequat. Vivamus ut odio efficitur, ultricies diam sit amet, iaculis augue. Suspendisse bibendum risus neque, ac pulvinar quam convallis et. Integer facilisis, dolor sit amet fermentum dictum, justo ex iaculis lorem, vitae placerat augue nulla ut magna.

Vestibulum ante ipsum primis in faucibus orci luctus et ultrices posuere cubilia curae; Nulla facilisi. Nam nec placerat erat, et maximus erat. Fusce vel vestibulum orci. Suspendisse hendrerit leo non enim porta tempor. Nunc tempor ac odio laoreet aliquet. Etiam commodo dapibus mollis. Fusce laoreet turpis mi, id fringilla quam consectetur quis. Duis ac nulla eu sem tristique venenatis. Ut porttitor nunc quis maximus facilisis. Ut sed volutpat dolor. Integer sollicitudin elementum augue vel pulvinar. Suspendisse mollis nisl vel commodo placerat. Mauris imperdiet pharetra tortor eu sodales. Interdum et malesuada fames ac ante ipsum primis in faucibus.

Integer condimentum neque hendrerit, pretium magna at, viverra mauris. Mauris viverra suscipit erat a rhoncus. Morbi finibus tortor maximus efficitur vestibulum. Suspendisse id tortor eget nulla pellentesque porttitor vel ut dui. Integer ac diam faucibus, ultrices ex nec, malesuada sapien. Sed imperdiet blandit dolor vitae gravida. Mauris nec diam eget turpis dapibus pretium in ac nunc. Nulla scelerisque tincidunt elit sit amet mollis. Donec ut eleifend tortor. Suspendisse eros nisi, aliquet vel nibh sed, ultrices luctus dolor. Aliquam at purus in dolor varius ultricies. Mauris facilisis enim laoreet justo consectetur, ut scelerisque magna commodo. Morbi vitae egestas mi. Aenean lacinia leo non est suscipit lacinia. Curabitur sed scelerisque lacus.

Fusce arcu arcu, facilisis sed faucibus at, consectetur eu nulla. In vel nunc dictum leo consequat ultricies eget ac ipsum. Etiam vestibulum aliquet condimentum. Proin vehicula sem et urna malesuada ullamcorper eu in arcu. Sed luctus ullamcorper nunc. In ornare purus sed ipsum lobortis dictum. Nam eros magna, tincidunt a enim gravida, mollis rutrum eros. Vivamus gravida ornare odio, eget interdum metus finibus id. Quisque sit amet sem ac ante ultricies finibus.

Etiam eget arcu accumsan, maximus risus vitae, efficitur nunc. In eu sem sagittis, tristique magna et, tincidunt ex. Cras vel dolor euismod elit lobortis congue. Nullam imperdiet rutrum tristique. Donec a nibh eu ante sodales accumsan non nec justo. Nullam luctus efficitur posuere. Donec nisi neque, sodales in efficitur a, feugiat ut urna. Duis consectetur, metus sit amet eleifend feugiat, mi augue consequat eros, in scelerisque metus dolor sit amet nulla. Praesent sit amet hendrerit ipsum, non porttitor sapien. Pellentesque habitant morbi tristique senectus et netus et malesuada fames ac turpis egestas. Vestibulum ante ipsum primis in faucibus orci luctus et ultrices posuere cubilia curae; Aenean ultricies mattis metus nec lobortis. Vivamus vestibulum finibus sollicitudin. Praesent suscipit sapien odio, in porttitor mauris tincidunt et. Nullam ultrices fermentum velit. Donec ac hendrerit quam, eget congue quam.

Vivamus viverra tortor tellus, quis luctus ex finibus at. Maecenas dignissim tortor et nisi pretium luctus. In hac habitasse platea dictumst. Maecenas bibendum sed nisl eget dapibus. Etiam viverra, lectus vitae convallis tempus, tortor elit sodales nisl, ut egestas magna tellus vitae orci. Cras vitae turpis quam. Quisque consectetur quam eget odio blandit, eget dignissim erat tincidunt. Aliquam ut placerat erat. Suspendisse potenti. Duis malesuada venenatis nibh sit amet dapibus.

Suspendisse sit amet turpis vestibulum, fringilla justo ut, varius nulla. Pellentesque eget lacinia nulla. Curabitur vitae scelerisque dui, at laoreet leo. Suspendisse potenti. Integer at arcu ligula. Integer tortor nisl, sagittis sit amet dolor et, luctus accumsan nunc. Phasellus auctor pellentesque sem, gravida gravida diam vestibulum vitae. Pellentesque id magna quis dui finibus mattis. Duis vel lacus dictum, maximus nulla eget, mattis dolor. Donec congue interdum tellus non sollicitudin. Aliquam mattis ultricies egestas. Praesent eget lectus id nibh tincidunt rhoncus. Sed risus purus, viverra eu turpis a, gravida ornare arcu.

Curabitur varius ante nec ligula elementum viverra. Duis facilisis commodo nibh congue elementum. Maecenas vel efficitur ante, a pretium sapien. Quisque a semper magna. Fusce tincidunt, odio et semper vestibulum, est ligula semper erat, a posuere justo urna non odio. Phasellus volutpat sem non nisi accumsan, quis fermentum mauris pretium. Suspendisse elementum, ligula vel semper molestie, risus massa ullamcorper ipsum, quis rutrum odio leo a nunc. Ut bibendum ac lacus non fermentum. Maecenas ornare ligula at ante faucibus vestibulum. Vivamus euismod enim tellus. Vestibulum ante ipsum primis in faucibus orci luctus et ultrices posuere cubilia curae;

Integer iaculis vitae neque sit amet condimentum. Fusce rhoncus dui at sem aliquam, nec efficitur ante fringilla. Nam ut tellus metus. Ut sed dignissim ex. Ut dapibus ipsum id turpis blandit, ut consectetur risus tincidunt. Etiam porttitor convallis nisl at semper. Nullam vel tortor eu ipsum posuere pharetra. Etiam in nisl ac diam dictum vulputate sit amet quis est. Donec at tellus gravida, suscipit purus in, viverra lectus. Nunc maximus, lorem at mollis imperdiet, tortor erat pharetra felis, vitae commodo odio enim sollicitudin nibh. Aenean mollis, justo non lobortis consectetur, metus libero scelerisque ipsum, interdum vestibulum erat sem efficitur ipsum.

