Lorem ipsum dolor sit amet, consectetur adipiscing elit. Cras ac nisi mattis, molestie arcu quis, tempor arcu. Fusce pulvinar, ipsum id interdum mollis, metus nisi pretium risus, at faucibus velit mi eget lorem. Ut lobortis sodales lacus, et commodo lorem tempor in. Vestibulum at nisl in nisl dapibus interdum. Pellentesque bibendum, dolor vitae facilisis viverra, leo orci viverra odio, ac venenatis tortor odio eget eros. Nulla facilisi. Curabitur ornare augue sit amet suscipit iaculis. Curabitur hendrerit ex ac enim lacinia, sed efficitur massa maximus. Vestibulum suscipit lectus a fermentum eleifend.

Vivamus tristique vel risus vitae consequat. Curabitur eu imperdiet quam, sit amet facilisis felis. Sed ligula enim, cursus id purus sit amet, pulvinar suscipit erat. Integer at est tincidunt, mollis lorem ut, faucibus nunc. Aliquam venenatis, augue in malesuada tempus, mi nulla posuere risus, a efficitur neque justo vel orci. Cras non magna consectetur, venenatis lacus eget, vulputate erat. Ut nibh est, lobortis non pellentesque a, tempus quis massa. Donec accumsan a orci non consequat. Cras et suscipit ligula, in pulvinar lorem. Etiam mattis iaculis enim a vehicula.

Nullam tincidunt blandit lacinia. Nunc urna dolor, vulputate maximus turpis ut, tristique vestibulum mauris. Etiam vel placerat tellus. Nulla porta sit amet dolor eu posuere. Pellentesque vitae augue posuere quam porta maximus ac fermentum est. In sagittis nisi vitae felis auctor egestas. Phasellus at dignissim justo. Ut ullamcorper aliquam turpis in hendrerit. Integer tincidunt tincidunt velit, et scelerisque metus hendrerit eu. Praesent diam nunc, bibendum nec vehicula sit amet, lacinia ut nulla. Nullam volutpat, magna ut bibendum porttitor, nibh metus finibus purus, at mattis erat quam sit amet neque. Aliquam dui dui, efficitur eget purus eu, fermentum pretium ligula.

Nulla posuere neque magna, ac congue augue vulputate ut. Orci varius natoque penatibus et magnis dis parturient montes, nascetur ridiculus mus. Duis consectetur, sem quis porta gravida, augue sem venenatis nunc, eu feugiat orci eros sit amet elit. Ut eget aliquet lacus, vitae scelerisque orci. Proin nec erat vitae lorem molestie porttitor. Etiam accumsan ex sed mauris pellentesque lacinia. Duis posuere, lorem nec lobortis tempus, elit nunc rutrum odio, aliquet condimentum augue risus euismod massa. Morbi nec porttitor ligula. Donec sagittis turpis eget maximus laoreet.

Duis pellentesque commodo hendrerit. Suspendisse luctus iaculis lacus id vestibulum. Aenean eget sagittis elit. Duis mollis mollis elit, non molestie urna bibendum eget. Nam id congue ante. Cras iaculis tincidunt ante, quis rhoncus augue viverra vel. Nunc a ante ut sapien vehicula vulputate eu in dui. Phasellus finibus aliquam ullamcorper.

Cras eu ligula malesuada elit congue ultrices. Aenean in placerat leo. Donec lacus eros, feugiat at leo nec, iaculis aliquam libero. Sed velit ipsum, posuere id nibh sit amet, faucibus vestibulum eros. Pellentesque posuere, ipsum id rhoncus pellentesque, urna ex molestie magna, at ultricies mi sem at magna. Vestibulum nec erat posuere, venenatis nibh id, molestie metus. Donec eleifend congue odio non consectetur. Mauris a ligula turpis.

Quisque venenatis risus tortor, quis blandit urna fringilla ut. Pellentesque euismod nibh erat, id vehicula dolor tincidunt et. Nullam pharetra orci commodo, viverra lacus hendrerit, ultrices sapien. Aenean sit amet cursus orci, a eleifend quam. Sed sagittis aliquam ex vitae pharetra. Orci varius natoque penatibus et magnis dis parturient montes, nascetur ridiculus mus. Integer sagittis ligula a magna varius cursus. Mauris vitae auctor augue, quis feugiat sem. In porttitor lorem sit amet lectus vulputate lacinia.

Vivamus vel sagittis metus. Proin tempus augue nibh, vel ornare orci faucibus eu. Nullam feugiat suscipit aliquam. Donec ac tincidunt ante, quis ornare arcu. Nam vel dictum nunc. Vestibulum nec sem bibendum, sagittis justo ullamcorper, pulvinar metus. Nulla dictum, arcu vitae fermentum sollicitudin, dolor dolor ornare risus, quis viverra sapien urna vitae augue. Etiam pulvinar eget tortor at porta. Nullam eu nisl dui. Donec rutrum tempus tortor, lobortis molestie ante imperdiet at. Morbi pulvinar arcu sit amet odio imperdiet molestie. In fringilla nibh a orci laoreet aliquet. Duis feugiat odio id efficitur ultricies. Mauris vitae arcu vulputate nibh auctor posuere vitae non mauris.

Integer porta viverra eleifend. Mauris lacus nisl, feugiat non rutrum et, feugiat at dolor. Nullam vestibulum imperdiet tincidunt. Nulla laoreet lacus dapibus, pretium lacus a, efficitur mauris. Sed facilisis, mi id posuere aliquet, magna urna elementum mi, vitae euismod ipsum nunc vel nulla. Vestibulum volutpat a ligula sed volutpat. Phasellus ut diam nec libero tristique faucibus. Praesent non sem ligula. Duis ullamcorper pretium aliquam. Donec a mattis arcu. Praesent turpis odio, congue quis gravida sed, mattis sed neque. Aenean accumsan mattis consectetur. Sed eget fringilla nisl, vel luctus nisi. Proin posuere sed enim non aliquet.

Duis placerat orci id sollicitudin facilisis. Nunc pharetra lacus nec orci sollicitudin, quis fermentum tellus egestas. Nulla facilisi. Fusce pretium tincidunt efficitur. Etiam pharetra sollicitudin pretium. Vestibulum pretium id mi et porta. Pellentesque eu lacus nec ex consectetur egestas a a lectus. Sed nec scelerisque arcu, fermentum rhoncus dolor. Pellentesque gravida ante ac malesuada tincidunt. Aenean fringilla laoreet libero, nec mattis tellus congue eu. Sed porttitor risus et ipsum ornare condimentum. Aenean quis metus ut neque bibendum consequat. Mauris et lacinia augue.

Pellentesque nec neque ante. Proin quis ornare diam, ut vehicula dolor. Donec justo sapien, luctus quis euismod sit amet, tempus ac nunc. Praesent congue lectus quam, sed molestie nunc varius ut. Interdum et malesuada fames ac ante ipsum primis in faucibus. Nam blandit sapien a sagittis finibus. Fusce vel mi eget erat sollicitudin bibendum quis non enim. Vivamus venenatis risus vitae lorem condimentum elementum. Proin iaculis dolor leo, vel mollis turpis auctor at. Sed blandit, sem a ullamcorper lacinia, tellus dolor accumsan ipsum, sit amet venenatis ligula enim ut turpis. Nulla suscipit cursus bibendum. Praesent eu sapien sit amet ligula convallis tempus. Proin varius orci mauris, id blandit lorem malesuada ac. Etiam vitae turpis gravida, mollis lectus ac, ornare quam. Sed leo nibh, varius id eleifend ac, tristique ac ante.

Sed metus nisl, rhoncus euismod quam eu, varius ullamcorper nunc. Nunc ac placerat urna. Aenean ut molestie libero. Vivamus suscipit ipsum vel libero interdum posuere. Fusce eu suscipit nisi, et lacinia eros. Nulla hendrerit nunc id elit viverra ornare. Nunc sed dui eu arcu porta lacinia vestibulum a lorem. Ut congue mauris in diam elementum consectetur. Vivamus at felis ut arcu auctor pulvinar. Sed pellentesque ipsum at ante finibus vestibulum. Sed quis leo nisl. Lorem ipsum dolor sit amet, consectetur adipiscing elit. Maecenas quam ligula, euismod sit amet iaculis eu, vestibulum eu nisl. Aenean suscipit dui dui, sit amet blandit orci ultrices nec. Morbi consequat id justo sed iaculis. Nulla non sagittis eros.

Nulla sed neque vestibulum, tristique augue non, fermentum lectus. Vivamus sit amet aliquet lacus. Sed sit amet ultrices ante. Maecenas eu velit pulvinar, laoreet diam et, sollicitudin justo. Donec dignissim purus sit amet mi pretium malesuada. Nam ante massa, pretium nec malesuada non, tempor at justo. Aenean lorem ex, lobortis at nibh non, tempus fermentum nulla. Integer ac erat nisl. Donec placerat ut lorem eu interdum. In lobortis molestie leo nec suscipit. Pellentesque habitant morbi tristique senectus et netus et malesuada fames ac turpis egestas. Praesent consequat lacus ut lorem molestie, vitae ultrices lorem pharetra. Nunc ac lacinia velit. Morbi nisl odio, bibendum a aliquam tempus, sollicitudin et purus. Nullam nec sem eu diam commodo pellentesque venenatis eu mi.

Duis tincidunt velit id nisl bibendum pulvinar id non justo. Aenean tempor, sapien ac rutrum placerat, metus felis porta tortor, sed venenatis tortor leo non tellus. Quisque luctus lobortis nulla, mattis fringilla nibh laoreet nec. Pellentesque non purus enim. Vestibulum ante ipsum primis in faucibus orci luctus et ultrices posuere cubilia curae; Ut et mi quis neque molestie mattis eget eu dui. Curabitur tincidunt maximus elit, nec imperdiet lectus aliquam sit amet. Morbi congue vulputate pellentesque. Donec dictum lobortis porta. Nam ultricies turpis ac mi ultrices efficitur. Orci varius natoque penatibus et magnis dis parturient montes, nascetur ridiculus mus.

Nunc luctus arcu at nibh volutpat fermentum. Etiam nec egestas lectus. Integer posuere ligula vel tellus pellentesque, sed pellentesque nisl volutpat. Etiam facilisis est in porta venenatis. Sed sagittis porta malesuada. Quisque elit dui, laoreet sit amet vestibulum at, ornare eu purus. Nunc accumsan risus sit amet mauris tincidunt, eget lobortis est congue. Proin malesuada ligula non commodo sollicitudin. Nunc a accumsan velit. Integer fringilla nunc elit, at ornare velit maximus vel. Morbi tincidunt sed massa eu sollicitudin. Vestibulum eget ipsum nec dolor egestas maximus.

Etiam facilisis, mauris non lacinia viverra, lorem sem luctus eros, nec egestas magna nunc eget risus. Morbi eleifend sem quis risus suscipit, eu vulputate lorem molestie. Nam non dignissim sapien. Cras vel finibus libero. Proin cursus tortor ut congue viverra. Donec nec rutrum nisl. Cras ultrices turpis vitae justo porta pharetra. Aenean ac ultricies nulla. Donec rutrum augue sed odio scelerisque efficitur. Integer et aliquam libero. Nullam a nibh dolor. Nunc maximus quam ac mauris ultricies, non imperdiet ex semper. Interdum et malesuada fames ac ante ipsum primis in faucibus. Donec auctor, turpis at aliquet placerat, felis lacus commodo lacus, non viverra magna dui at justo.

Fusce pulvinar iaculis massa ac dignissim. Aliquam blandit laoreet aliquam. Integer laoreet ut lacus ultricies dignissim. Duis purus massa, molestie at sapien eget, porta commodo risus. Maecenas finibus condimentum est et aliquam. Nullam efficitur lectus sit amet ante sodales, eu rutrum sapien eleifend. Sed id sapien id sapien hendrerit feugiat eget maximus enim. Maecenas pharetra ex massa, at consectetur elit auctor in. Integer egestas laoreet ipsum sit amet feugiat. Morbi venenatis justo ac dolor malesuada scelerisque. Fusce aliquet non mi sit amet fringilla. Mauris felis lectus, dictum ac justo ut, vulputate commodo dui.

Donec orci lectus, tempus a dignissim eget, sagittis non dui. Vivamus in augue et justo gravida placerat non tempus orci. Donec sit amet justo in nibh mattis efficitur. Suspendisse at posuere velit, nec vestibulum sapien. Proin dictum, metus sit amet pulvinar feugiat, nibh odio consectetur tellus, eu sagittis dolor lacus ut sapien. Sed efficitur neque tortor, quis ultricies neque vestibulum vitae. Proin laoreet ipsum a blandit congue.

Ut sit amet mi a dui pharetra lacinia vitae eleifend tellus. Donec velit sapien, consectetur id faucibus id, mattis id turpis. Duis interdum neque eros, sit amet viverra dui sodales quis. Duis dictum ante eros, sit amet iaculis purus interdum in. Morbi non ligula id nunc fermentum sodales. Suspendisse dapibus facilisis fringilla. Praesent nec pharetra velit, in fermentum nibh. Integer feugiat porta est. Maecenas sit amet dolor non mi pulvinar pulvinar. Donec pellentesque dictum pulvinar. Donec tempor est ex, vel mollis est suscipit in. Sed quis nisl leo. Cras tempor lorem mi, quis condimentum diam auctor at. Praesent eget dictum ante.

Mauris ac varius nulla. Proin porta rhoncus dolor eget egestas. Proin id est enim. Maecenas volutpat a dolor vel mollis. In at turpis sem. Morbi vel turpis ac orci auctor consectetur. Vivamus erat enim, blandit quis vulputate sit amet, eleifend sed diam. Mauris finibus sapien in lacus vehicula ornare. Class aptent taciti sociosqu ad litora torquent per conubia nostra, per inceptos himenaeos.

Phasellus vulputate in purus vitae volutpat. Etiam mattis, sapien ut malesuada molestie, dolor nibh pellentesque mauris, ut rhoncus magna libero sed quam. Fusce mollis bibendum enim, sed ornare lacus vestibulum non. Etiam accumsan tristique sollicitudin. Curabitur metus elit, sodales a metus id, ultrices cursus nisi. Aliquam pretium enim tortor, ac aliquam arcu accumsan quis. Sed eros mauris, dignissim ut elit vitae, elementum vulputate metus. Donec commodo nisi eget porta iaculis. Praesent suscipit semper purus nec vestibulum. Nunc tempor at nisi pretium pretium. Fusce velit est, pulvinar in ullamcorper id, euismod ullamcorper felis. Vestibulum risus magna, eleifend vel varius sit amet, fermentum vitae libero. Quisque ligula mauris, luctus at rhoncus a, pellentesque a dolor. Nullam faucibus eros quis vehicula ullamcorper. Maecenas condimentum nulla eget ante vehicula lacinia. Vestibulum lobortis tempus ex.

Maecenas bibendum placerat enim, ut tempor enim malesuada ut. Etiam fringilla neque commodo, imperdiet nisi in, blandit ligula. Praesent vitae magna et mauris gravida vulputate non nec felis. In quis tincidunt odio, et hendrerit justo. Mauris lectus quam, dapibus ut arcu eu, feugiat congue turpis. Nam sagittis est ut est imperdiet, a venenatis tellus tincidunt. Nulla facilisi. Vivamus lacinia dolor leo. In hac habitasse platea dictumst. Vestibulum ac eros mauris. Curabitur mattis semper lorem vel venenatis. Curabitur posuere tristique leo eu sodales.

Cras feugiat, orci sed maximus auctor, lacus nisi blandit urna, quis lobortis turpis eros a nibh. Mauris posuere mollis mauris ac semper. Phasellus nibh tellus, eleifend ut imperdiet vitae, ullamcorper et ipsum. Suspendisse eu justo at mauris lacinia semper. Aliquam pharetra tortor leo, sed vulputate mauris porttitor at. Pellentesque urna elit, varius commodo sollicitudin ut, mollis quis dui. Proin blandit massa id orci condimentum condimentum. Nunc efficitur quam urna, ac egestas risus tristique vel. Donec vel neque vitae mauris ullamcorper faucibus ac eget neque. Fusce vehicula dui eu convallis malesuada. In dolor ipsum, condimentum sed tristique eu, blandit non nisl.

Donec sed efficitur nisl. Aenean eu molestie arcu. Phasellus a lobortis ante, a venenatis tortor. Etiam dictum velit ac dui auctor congue. Fusce ut ligula ac orci consectetur porta sit amet ut nunc. Suspendisse vel massa nibh. Duis porta venenatis lorem mattis vehicula. Pellentesque hendrerit tortor arcu, quis condimentum ligula commodo vitae. Vestibulum magna massa, volutpat non lorem non, interdum efficitur diam. Maecenas suscipit, est vitae hendrerit cursus, eros leo semper diam, sit amet ullamcorper enim sapien eu justo. Ut congue convallis libero, eget eleifend sem. Maecenas in ante a tellus imperdiet dapibus nec commodo ex.

Vivamus efficitur arcu ut mauris condimentum, quis aliquet sapien ornare. Aenean nec nulla molestie lorem fermentum ultricies. Nam scelerisque bibendum felis, in molestie augue bibendum eu. Integer mi felis, iaculis in metus a, tincidunt suscipit urna. Integer molestie lobortis libero nec egestas. Praesent id justo congue, bibendum risus quis, dictum felis. Suspendisse tortor urna, feugiat quis vulputate vel, consequat et nisi. Vivamus in malesuada augue. Morbi ligula dui, rutrum vitae rutrum eget, convallis a nunc. Sed sagittis dictum elit, sed suscipit enim. Donec tempor magna odio, vel cursus justo congue in. Vestibulum cursus ligula nec lectus interdum, vitae euismod dolor viverra. Proin dignissim consectetur velit.

Ut rhoncus ex sed tristique molestie. Maecenas libero turpis, pulvinar aliquam magna ac, maximus pretium nulla. Aenean tristique ut neque sed fringilla. In suscipit velit dui. Praesent ultrices ante nisl, a consectetur nulla scelerisque in. Aliquam et nisl quam. Aenean sodales purus erat, ac gravida sem imperdiet sed. Pellentesque dolor sapien, dictum ut dictum id, posuere ac justo. Phasellus at dictum mi, at commodo arcu. Nulla finibus nisi vel risus ultricies rhoncus. Vestibulum vestibulum orci orci, eu luctus nisl commodo eu. Ut venenatis mattis enim sit amet venenatis. Duis eget viverra turpis. Cras venenatis, arcu sed feugiat accumsan, urna nisi dignissim nisi, ut tempus libero ligula quis felis.

Curabitur pretium bibendum felis, id gravida orci porta at. Vivamus vitae turpis sed tortor efficitur blandit. Cras vehicula, purus sed laoreet rhoncus, magna ex cursus diam, non molestie quam justo eget tortor. Curabitur tincidunt, lectus eget varius volutpat, dolor metus sodales elit, vitae varius ex lacus in nisi. Sed neque tortor, venenatis eleifend lacus vitae, posuere porttitor dolor. Etiam id pellentesque quam. Aliquam hendrerit mauris ipsum, a sodales mi fermentum ut. Nullam lacinia, justo ac pharetra vulputate, sem turpis gravida mauris, a porta turpis urna vel ex. Morbi malesuada maximus turpis eu vulputate. Etiam sit amet convallis ex. Pellentesque neque mi, scelerisque id consequat mattis, pretium iaculis tortor. Vestibulum ornare iaculis est id dapibus. In sit amet quam id nulla posuere volutpat. Integer elementum, leo sed euismod iaculis, dolor mauris viverra ipsum, a aliquam erat risus ac nibh.

Duis nunc orci, placerat sit amet finibus vel, maximus ut ante. Vivamus dignissim est quis metus aliquet, quis ultricies dolor dapibus. Vivamus vitae orci at sapien pretium tempor sed dictum leo. Pellentesque massa lacus, placerat et lectus et, iaculis dapibus nunc. Cras in quam porttitor, ullamcorper sapien pharetra, euismod nisi. Nunc tincidunt lacus congue, tincidunt nulla eu, vulputate odio. Nam placerat, libero a lacinia dapibus, lorem quam molestie mi, vel vulputate velit lectus eu nisi. Sed eu ipsum consectetur, dapibus dui posuere, lobortis mi. Integer quis urna nec lorem egestas maximus non dictum elit. Pellentesque nibh turpis, facilisis id placerat vitae, tempus sed mauris. Donec ut cursus mauris, eget posuere elit. Donec dictum ultricies diam, et porttitor diam dictum in. Curabitur consequat lacus eros.

Ut ac rutrum massa, vel egestas purus. Nam tempor dignissim fringilla. Morbi ac scelerisque neque. Fusce massa nisl, porta non suscipit sit amet, commodo in felis. Nunc lobortis vel metus quis gravida. Quisque pretium pretium purus, tempor scelerisque dolor pulvinar eget. Pellentesque at neque arcu. Sed scelerisque, erat quis pretium mollis, enim elit ornare tortor, quis convallis lacus lorem non purus. Suspendisse tincidunt elit quis auctor vulputate. Curabitur vel lectus metus.

Class aptent taciti sociosqu ad litora torquent per conubia nostra, per inceptos himenaeos. Aenean rutrum cursus mauris, ornare semper est posuere blandit. Donec vestibulum, urna nec congue tempor, turpis velit condimentum ipsum, ac finibus turpis nunc ut elit. Pellentesque convallis imperdiet nisl. Curabitur finibus, urna et ultricies dignissim, lacus sapien feugiat est, euismod sodales dolor urna et leo. Pellentesque elit ex, egestas id egestas sollicitudin, mattis sed neque. Quisque massa mi, tempor lacinia vulputate ac, efficitur ac velit. Donec nec risus commodo, auctor felis in, pretium ligula. Quisque nec laoreet est. Suspendisse porta felis quis augue imperdiet, eget convallis elit venenatis.

Suspendisse in massa sit amet massa fringilla ultricies. Sed luctus, neque at aliquam laoreet, metus dolor mollis ante, vel facilisis dolor sem at libero. Cras vel convallis magna, pulvinar suscipit nibh. Nam consequat volutpat nisi sit amet iaculis. Nunc blandit dolor et rutrum aliquam. Proin rutrum eget ex sit amet elementum. Curabitur ornare erat a quam cursus vulputate non quis arcu. In et leo nulla. Quisque et elementum magna, vel finibus tortor. Nunc vitae laoreet risus. Praesent diam augue, bibendum vitae massa iaculis, sollicitudin lobortis erat. Proin sed blandit neque, eget maximus ligula. Duis vitae tempor ex, convallis tempor diam. Nullam id nisl auctor, venenatis diam semper, posuere orci. Morbi in semper massa, sed venenatis nulla. Ut sit amet erat quis urna fringilla dictum nec viverra tellus.

Sed magna dolor, venenatis non luctus eu, imperdiet ac dolor. Cras quis purus ultrices, suscipit purus eget, pellentesque mauris. Maecenas finibus bibendum euismod. Nulla iaculis diam et arcu rhoncus, eget suscipit lectus dictum. Curabitur finibus fringilla ex eu aliquet. Maecenas vel fermentum enim, id pulvinar diam. Integer fringilla nunc ut felis tempor, eu ullamcorper velit porta. Praesent cursus, nisi et consequat condimentum, risus ante scelerisque est, nec varius ligula augue sit amet dui. Etiam ut tristique quam. Vivamus molestie pulvinar maximus. Nulla sed convallis ante. Vivamus rutrum massa at odio mattis, ac porttitor nunc fermentum. Pellentesque in commodo leo, id mollis lectus. Sed nec magna a turpis congue malesuada. Vivamus leo sapien, laoreet a varius euismod, auctor quis nibh. Maecenas pretium lorem metus, id auctor nibh accumsan quis.

Nulla eu est eu tortor condimentum ullamcorper ut non sem. Curabitur elementum sollicitudin consequat. Nam aliquam metus bibendum, semper velit sed, malesuada ante. Suspendisse vel orci eu metus pretium luctus in ac orci. Vivamus a ligula sollicitudin, facilisis tortor a, mollis erat. Fusce scelerisque eleifend interdum. In fermentum mattis vulputate. Nullam et ipsum mattis dolor euismod molestie. Pellentesque convallis pellentesque commodo. Phasellus elementum sodales erat, at scelerisque tortor tempus et. Donec mollis turpis in hendrerit luctus. Vestibulum ante ipsum primis in faucibus orci luctus et ultrices posuere cubilia curae; Vestibulum scelerisque pellentesque dui, sed dignissim lorem. Sed ornare est pretium lectus commodo maximus. Donec porttitor eros odio, nec iaculis magna lobortis non. Morbi consequat nisl nec nulla finibus iaculis.

Vestibulum sit amet pulvinar sem, id ultricies nisi. Curabitur sodales sodales aliquam. Proin eu metus elit. Pellentesque quis ipsum sed nisi fringilla consectetur. Nunc nisl nisi, bibendum sit amet condimentum at, cursus eu est. Fusce hendrerit tellus eros, sit amet condimentum ante dictum eu. Praesent euismod ut dolor eleifend scelerisque. Proin posuere lacus eget tellus congue, condimentum dapibus arcu condimentum. Maecenas non mollis felis. In mollis ex nec mauris sagittis, et scelerisque enim maximus. Pellentesque odio augue, accumsan sit amet nisi et, lobortis pharetra leo. Morbi gravida ante quis mi laoreet sodales.

Duis augue lacus, viverra eu purus sit amet, pharetra interdum arcu. Quisque vel varius velit. Sed gravida tellus non sapien interdum condimentum. Sed finibus gravida blandit. Mauris elementum arcu libero, in facilisis nisi varius quis. Curabitur dapibus mollis cursus. Vivamus quis est convallis, suscipit purus ut, mollis ipsum. Maecenas imperdiet aliquam magna ac fringilla. Suspendisse commodo commodo sapien, eget ultricies nulla posuere sit amet. Quisque et interdum nulla.

Ut vitae leo ut dui suscipit rutrum nec nec eros. Cras imperdiet enim sed neque lacinia sodales. Nullam massa lectus, malesuada vitae ultricies laoreet, cursus eget nisi. Quisque vel convallis nulla. Pellentesque quis nisi suscipit, pharetra orci eu, ornare urna. Nullam faucibus vulputate suscipit. Morbi non justo urna. Praesent vestibulum porttitor purus vitae condimentum. Morbi sapien sem, viverra ut ante quis, cursus mollis magna. Nam convallis metus dui, in pellentesque turpis pellentesque vel. Maecenas nec sem dolor. Donec eu orci ac ante tincidunt malesuada nec id justo. Phasellus tristique vitae tortor ac dapibus.

Sed ullamcorper magna et arcu volutpat, vitae posuere nisi viverra. Maecenas ullamcorper tristique orci, ut commodo odio congue et. Praesent tincidunt libero sit amet odio tincidunt, vitae convallis ex maximus. Phasellus est lectus, rutrum a tellus et, sagittis sodales est. Nulla vehicula risus quis est tempor, quis euismod eros ullamcorper. Integer a vestibulum purus. Etiam pellentesque aliquam odio, vitae venenatis justo luctus a. Mauris varius sapien eros, nec volutpat enim pharetra non. Nunc et mi accumsan orci sodales venenatis. Nam eu metus non est consequat volutpat. Morbi imperdiet, augue rhoncus imperdiet semper, lorem mauris interdum risus, nec gravida elit diam sit amet ligula. Maecenas nec tempor nunc, nec pulvinar augue. Ut ac volutpat ex.

Etiam sodales congue blandit. Cras quis metus a leo molestie feugiat. Donec eget massa vestibulum, maximus massa a, gravida orci. Etiam commodo enim quam, nec porta massa sodales non. Morbi mollis risus a leo ultrices, a venenatis ex congue. Maecenas condimentum ipsum suscipit, semper nibh consequat, convallis turpis. Mauris vitae massa pretium, vulputate turpis non, porttitor turpis. Donec faucibus venenatis purus ac ultrices. Suspendisse eleifend nunc a aliquam vestibulum. Aenean consectetur tempor nunc, vitae faucibus elit sagittis at.

Aenean nibh tellus, eleifend ac vulputate eu, consequat id mi. Sed tempus egestas est, ac mollis turpis venenatis sed. Maecenas porta, arcu ac mollis blandit, ex lacus aliquet dolor, et condimentum risus leo sed elit. Cras feugiat pellentesque est, vel convallis dolor lobortis ut. Mauris et mauris a mauris egestas pulvinar. Integer sit amet erat rutrum, molestie tellus dapibus, tempor felis. Ut felis enim, ornare non nibh quis, tristique convallis ante. Donec eget quam efficitur, pretium nisl ut, malesuada erat. Quisque lacinia nunc id fermentum mollis.

