Quisque quis porttitor ligula. Phasellus hendrerit felis ut ligula imperdiet, eu vestibulum ipsum feugiat. Donec mattis bibendum justo. Aliquam in magna sed dui commodo placerat. Ut dui lectus, scelerisque vel enim in, gravida interdum nibh. Nam fringilla blandit maximus. Donec dapibus ultricies urna et sodales. In augue orci, vestibulum id nulla ut, commodo faucibus eros. Praesent ligula lectus, malesuada quis ex non, placerat aliquam libero. Pellentesque non ultricies augue, eget egestas orci. Praesent congue risus vel felis venenatis rhoncus. Duis pharetra ultricies tincidunt. Quisque faucibus tincidunt lacinia. Mauris ac ipsum ut dui tincidunt sollicitudin. Nam rhoncus id lacus vel imperdiet. Vivamus gravida metus non tortor iaculis, vitae pretium elit vehicula.

Maecenas malesuada mollis felis dictum tristique. Nullam vitae odio interdum, tempor quam nec, pellentesque ligula. Quisque venenatis nulla vel vehicula euismod. Proin tempus pretium turpis, sit amet pharetra magna mollis eget. Aenean sodales, lectus sed fermentum tincidunt, ex leo vulputate urna, ut convallis purus urna non odio. Etiam malesuada consectetur est, at tincidunt mi pharetra eget. Proin ac leo hendrerit, euismod sapien facilisis, convallis nunc. Donec volutpat, est in pulvinar ultricies, erat mi dictum arcu, consequat ultrices lectus nisl eu massa. Duis vel rutrum libero, eu volutpat purus. Maecenas in leo quis lorem mattis mollis. Donec convallis eros sed odio tempus ultricies. Fusce orci quam, cursus vel elit non, aliquet ullamcorper nibh. Morbi elementum faucibus efficitur. Vivamus ac ligula mollis, viverra mauris in, placerat dolor. Vestibulum ante elit, condimentum sit amet enim nec, vulputate venenatis nibh. Nam dapibus libero sit amet accumsan vulputate.

Aliquam erat volutpat. Curabitur ligula libero, commodo at blandit quis, ultricies sed augue. Phasellus eu nisi quis nulla maximus venenatis et ut ipsum. Sed eget dolor sed sem ultrices commodo. Praesent non vulputate velit. Fusce eget interdum massa, non volutpat lectus. Proin vitae lorem at ante tempus lobortis. Phasellus ut venenatis risus. Aliquam mattis dolor nulla, a varius dolor tincidunt ac. Suspendisse bibendum volutpat faucibus. Pellentesque habitant morbi tristique senectus et netus et malesuada fames ac turpis egestas. Duis consectetur magna at porta fermentum. Quisque sed lectus at mi aliquet vestibulum a faucibus mi. Duis laoreet lectus fringilla, condimentum lacus sed, semper lacus.

Etiam quis sapien urna. Mauris volutpat lorem eu commodo facilisis. Nullam at aliquam velit. Nulla interdum ornare nunc ut viverra. Nam suscipit tempor velit, eget malesuada nunc feugiat vitae. Pellentesque iaculis at magna vulputate imperdiet. Donec dui sem, tempus eget semper vitae, vestibulum a nulla. Fusce tincidunt congue gravida. Cras faucibus turpis eu pellentesque luctus.

Cras eu condimentum urna, at maximus risus. Suspendisse molestie nisl ut nisi tempus bibendum. Vestibulum tincidunt, augue non egestas efficitur, dolor massa tincidunt justo, ullamcorper volutpat leo dolor sed lectus. Integer in euismod purus, in placerat dui. Aliquam quis est massa. In hac habitasse platea dictumst. Praesent ex tellus, ultrices quis consectetur eu, tempus a mauris.

Mauris cursus aliquam massa, nec bibendum massa. Mauris id ante venenatis, tincidunt dolor sed, rhoncus lectus. Vestibulum eget porttitor ex. Aenean velit tortor, condimentum consectetur scelerisque ornare, ornare eget turpis. Aliquam porta orci a finibus hendrerit. Etiam semper ut massa in laoreet. Fusce vitae nibh libero. Mauris et semper sem. Donec non tempor lectus, a maximus mauris. Quisque turpis libero, volutpat quis tempus sit amet, pellentesque ut sapien. Phasellus semper rutrum ante luctus pellentesque. Etiam semper est ac sapien iaculis, placerat condimentum leo volutpat. Ut aliquam suscipit turpis vitae tincidunt. Phasellus sagittis sed augue id dictum. Etiam et ultricies nisl.

Nam tincidunt vitae ante eu dictum. Morbi tristique non erat eget faucibus. Vestibulum auctor enim at nibh varius, non ornare dolor tincidunt. Nullam suscipit egestas risus sagittis rutrum. Vivamus fermentum, risus et laoreet aliquet, orci est ultricies diam, eget suscipit ante nisi sed ipsum. Donec suscipit nisi velit, id ultricies nunc gravida sit amet. Aenean rhoncus bibendum justo sit amet facilisis. Sed facilisis nisl eget purus luctus, consequat auctor odio consequat. Maecenas sit amet nibh mi. Nunc posuere mi ac euismod pharetra. Donec condimentum lobortis purus. Sed ac facilisis lacus, sit amet semper erat. Pellentesque fringilla lacinia ante, vitae fringilla magna bibendum non. Cras vulputate nisi non nisi consequat commodo. Ut auctor lacinia arcu tristique blandit.

Suspendisse purus risus, cursus at malesuada vestibulum, consequat a velit. Proin vel consequat lacus. Integer sagittis augue sit amet enim ullamcorper, eget molestie felis efficitur. Aenean tincidunt sapien eu lacus lobortis blandit. Integer condimentum vestibulum massa. Nullam quis dapibus nisl. Etiam accumsan ante neque, eu gravida urna cursus ut.

Nulla ullamcorper nunc tortor, eget pellentesque enim fermentum et. Nam dapibus turpis orci, sit amet elementum augue lacinia ac. Mauris vulputate tincidunt dignissim. Maecenas porta massa vel dui malesuada rhoncus. Aliquam porttitor congue mi nec semper. Mauris tristique faucibus finibus. Orci varius natoque penatibus et magnis dis parturient montes, nascetur ridiculus mus. Duis tincidunt in nisi vel lacinia. Proin scelerisque orci nec vestibulum mollis. Orci varius natoque penatibus et magnis dis parturient montes, nascetur ridiculus mus. Etiam scelerisque a ligula vel dignissim. Aliquam porta lacus in diam ornare, non mollis lorem fermentum.

In ut augue mauris. Pellentesque blandit ut ante id pellentesque. Curabitur at libero quis justo pretium sollicitudin quis eu nisi. Nam a urna vel purus dapibus fermentum. Curabitur vel euismod orci, a accumsan mi. Quisque sed vestibulum ipsum, in pretium nunc. Aliquam at ante iaculis, scelerisque augue vel, luctus enim. Curabitur a enim a lacus feugiat vestibulum vitae id nibh. Nullam risus nisi, viverra at tellus nec, rutrum viverra tortor. Class aptent taciti sociosqu ad litora torquent per conubia nostra, per inceptos himenaeos. Pellentesque habitant morbi tristique senectus et netus et malesuada fames ac turpis egestas. Maecenas scelerisque egestas turpis tempus placerat. In eget faucibus tortor, nec posuere massa.

Etiam pharetra ut dolor id vestibulum. Integer pharetra enim in pellentesque gravida. Donec sit amet tellus sed elit pellentesque tristique in a turpis. Pellentesque habitant morbi tristique senectus et netus et malesuada fames ac turpis egestas. Suspendisse consectetur dignissim nisi, in luctus massa scelerisque nec. Nulla facilisi. Duis hendrerit massa nisi, sodales tristique leo pharetra sed. Quisque tincidunt non libero euismod malesuada. Maecenas vestibulum ornare urna, quis lacinia massa congue quis. In sed ligula et dolor suscipit facilisis quis eget nisi. Proin malesuada justo vel nulla elementum sollicitudin. In sit amet ultrices justo, quis commodo est. Phasellus molestie ipsum a leo sodales, pulvinar commodo urna suscipit. Nunc aliquet, massa at elementum semper, justo elit viverra arcu, ut feugiat orci ligula non mi.

Curabitur malesuada, purus in sodales ultrices, lectus metus luctus nibh, quis tincidunt sem risus varius ante. Nunc ut mattis lacus. Praesent vestibulum tortor quis sapien ultrices, porta molestie eros facilisis. Cras finibus metus tellus, suscipit luctus turpis posuere vel. Aliquam facilisis odio vitae massa pellentesque, nec facilisis lorem ultrices. Ut quis dolor elit. Nullam vitae condimentum enim. Aenean non convallis odio.

Aenean pharetra, est eget pellentesque fermentum, massa lacus faucibus tortor, commodo faucibus odio quam luctus ex. Suspendisse iaculis orci sapien, quis tincidunt neque lobortis nec. Sed consectetur euismod nisi, non vulputate libero iaculis id. Suspendisse efficitur metus at diam scelerisque egestas. Integer mollis ligula iaculis nibh efficitur, a convallis turpis sollicitudin. Mauris ornare erat ac quam maximus sagittis. Maecenas porttitor lacus lobortis magna faucibus, a ullamcorper dolor accumsan. Quisque cursus eros sed nisl ultrices dapibus. Praesent finibus erat metus, quis viverra dolor congue quis. Ut venenatis dictum enim, vel aliquam nunc.

Morbi euismod eros ut faucibus eleifend. Praesent euismod accumsan nisi, nec mollis neque egestas eu. Nam consequat porta eros ut malesuada. Morbi cursus lacus sapien, nec fermentum massa tempus ac. Nullam volutpat odio a lobortis auctor. Phasellus a sem sit amet odio dignissim faucibus. Sed egestas urna semper orci dictum scelerisque in vitae lacus. Integer pharetra commodo elit, a tristique tellus fringilla tempor. Donec cursus, dui eu rhoncus fermentum, mi turpis varius tortor, ut placerat quam justo at enim. Donec sagittis massa id consequat facilisis. Nullam enim justo, rutrum in metus id, tempus tincidunt leo. Curabitur facilisis nunc in tellus pulvinar, vitae vestibulum sem scelerisque. Mauris ac tellus at urna cursus consectetur. Aliquam id scelerisque metus. Quisque elementum diam ligula, non gravida arcu condimentum sed. Cras a blandit odio.

Vestibulum lobortis tellus mollis, mattis sem rhoncus, sollicitudin turpis. Curabitur felis ipsum, scelerisque vitae ligula maximus, sagittis auctor leo. Ut ultricies ex odio, sit amet venenatis nibh ultrices sit amet. Nam eget aliquet purus, vel varius ligula. Vivamus porta posuere dolor, eu bibendum orci cursus a. Sed consectetur odio in ante elementum porta. Proin condimentum neque placerat feugiat lacinia. Morbi vel odio erat. Praesent in sapien sit amet leo eleifend posuere sed ac dui. Proin ut fermentum metus, ut laoreet nisl. In ullamcorper sapien diam. Praesent condimentum consequat quam, eu facilisis nulla congue eget. Vivamus id sollicitudin massa. Curabitur non turpis at lacus aliquam aliquet nec non est. Suspendisse vel ante metus.

Vestibulum mi erat, hendrerit finibus tellus vel, ultrices suscipit lorem. Suspendisse vel pharetra dui. Nulla ullamcorper, dui id tristique malesuada, magna velit condimentum justo, eu congue nisl ipsum sit amet augue. Curabitur accumsan tellus ac urna ornare, nec lobortis mauris varius. Suspendisse tellus sapien, lacinia sit amet risus id, vulputate ornare nisi. Nulla sit amet vestibulum enim. Sed pulvinar feugiat est, ut dignissim nunc. In hac habitasse platea dictumst. Maecenas facilisis vitae eros sed rutrum. Nulla mattis semper sem in eleifend. Nullam bibendum, diam vitae finibus faucibus, nibh dui vulputate urna, eu iaculis sapien sem quis nibh. Nunc a ultricies magna, id ullamcorper augue.

Nam maximus lorem orci, eget fermentum nisl ultrices quis. Nulla pulvinar maximus ante, sit amet interdum urna vehicula in. Nulla turpis metus, iaculis vitae hendrerit ut, aliquet id lectus. Phasellus vehicula eu tellus nec tincidunt. Praesent non urna bibendum, volutpat sem accumsan, interdum libero. Vestibulum a odio tincidunt, accumsan urna sed, iaculis ante. Nunc eget massa dolor. Etiam sollicitudin libero nisi, in lobortis ligula pharetra vel. Vestibulum tempus ultricies semper. Orci varius natoque penatibus et magnis dis parturient montes, nascetur ridiculus mus. Integer dignissim fermentum orci, id porta purus bibendum scelerisque. Fusce quis ante mi.

Nam ac lacus nec nunc lobortis eleifend. Proin auctor consequat enim id fermentum. Integer non libero sed orci volutpat sodales. Nulla nec arcu vel libero feugiat condimentum. Aliquam molestie orci sem, ac efficitur eros feugiat vitae. Vivamus vitae posuere urna. Quisque at commodo justo, vel maximus massa. Pellentesque massa urna, faucibus vitae varius vitae, dignissim ac ante. Suspendisse sit amet ultricies dui. Cras euismod sem eu purus commodo, in maximus quam ultrices. Nam sagittis turpis arcu, at dignissim lectus interdum nec. Nulla vitae condimentum ligula. Donec hendrerit, tortor nec tempor consectetur, dolor nisi commodo quam, at maximus leo nibh ac elit. Morbi quis dapibus orci. Suspendisse bibendum est at rutrum aliquet.

Quisque sed dictum dui. Nunc vel pellentesque massa, a dignissim libero. Ut a dolor sem. Duis diam nisl, egestas rhoncus risus sit amet, tincidunt suscipit libero. Suspendisse quis sapien sed urna sollicitudin malesuada. Etiam tempor, ex eu sodales euismod, tortor metus vulputate mauris, sit amet tempor ante diam nec orci. Pellentesque consequat in odio eget ullamcorper. Donec porta arcu nec placerat efficitur. Suspendisse aliquet odio eget sagittis egestas. Praesent volutpat porta massa, eget mattis orci auctor eget. Sed sed orci et massa sagittis ultricies at sed felis. Sed non suscipit nisl. Donec aliquet pretium nisl ut tristique. Vestibulum gravida gravida augue in porta.